<Entities xmlns:xsi="http://www.w3.org/2001/XMLSchema-instance" xsi:noNamespaceSchemaLocation="EntitiesSchema.xsd">
  <Entity>
    <PublishCertificatetoTDPS>true</PublishCertificatetoTDPS>
    <EntityProfile Name="DUSGen2OAM_CHAIN_EP"/>
    <KeyGenerationAlgorithm>
      <Name>RSA</Name>
      <KeySize>2048</KeySize>
    </KeyGenerationAlgorithm>
    <Category>
      <Modifiable>true</Modifiable>
      <Name>NODE-OAM</Name>
    </Category>
    <EntityInfo>
      <Name>LTE01dg2ERBS00006-oam</Name>
      <Subject>
        <SubjectField>
          <Type>ORGANIZATION</Type>
          <Value>ERICSSON</Value>
        </SubjectField>
        <SubjectField>
          <Type>ORGANIZATION_UNIT</Type>
          <Value>BUCI_DUAC_NAM</Value>
        </SubjectField>
        <SubjectField>
          <Type>COUNTRY_NAME</Type>
          <Value>SE</Value>
        </SubjectField>
        <SubjectField>
          <Type>COMMON_NAME</Type>
          <Value>LTE01dg2ERBS00006-oam</Value>
        </SubjectField>
      </Subject>
    </EntityInfo>
  </Entity>
</Entities>
